{
  "schema_version": "1.0.0",
  "register_id": "speech_sound_provider_register",
  "register_version": "1.1.0",
  "checkpoint": "22E1",
  "updated": "2026-07-24",
  "secrets_policy": "credentials are referenced by gitignored .env variable name only; no secret value, account password, multifactor code or recovery code may ever appear in this register",
  "lanes": [
    {
      "lane_id": "azure_speech",
      "display_name": "Microsoft Azure AI Speech pronunciation assessment",
      "kind": "external_api",
      "role": "core_external_score_comparator",
      "status": "ready",
      "reason": "Australia East resource exists and its credential authenticated; public Microsoft Online Services terms permit comparative benchmarking and publication; en-AU output is score evidence only and en-US named or N-best phones remain a separate dialect-limited evidence class, never Australian truth.",
      "audio_policy": "corpus_transfer_review_required",
      "eligible_sources": [
        "speechocean762",
        "acted_clear_speech",
        "common_phone_1_0",
        "librispeech_slr12_small"
      ],
      "output_semantics": "en-AU returns per-position phoneme accuracy scores without phoneme names; phoneme names, IPA alphabet, syllable groups and NBest spoken phonemes are documented for en-US only; locales must never be pooled and en-US produced-phone output may inform dialect-stable consonant relations only.",
      "permissions": {
        "benchmark_publication": "permitted_by_public_terms",
        "evidence": [
          {
            "claim": "Universal License Terms for Online Services contain no approval requirement for benchmarking; the Competitive Benchmarking clause imposes only reciprocal duties on customers offering competing services",
            "source": "https://www.microsoft.com/licensing/terms/product/ForOnlineServices/all",
            "verified": "2026-07-23"
          }
        ]
      },
      "privacy": {
        "processing_region": "australiaeast; Azure Speech does not store or process data outside the resource region",
        "retention": "real-time pronunciation assessment audio is processed in server memory and not retained",
        "training_use": "customer audio is not used to train Microsoft models"
      },
      "credentials": {
        "env_var_names": [
          "AZURE_SPEECH_KEY",
          "AZURE_SPEECH_REGION",
          "AZURE_SPEECH_ENDPOINT"
        ],
        "verified": {
          "date": "2026-07-24",
          "method": "sts/v1.0/issueToken request against the australiaeast endpoint using the .env key without printing it; no audio sent",
          "outcome": "HTTP 200"
        }
      },
      "prohibited_uses": [
        "treating any Azure score as reference or Australian truth",
        "pooling en-AU and en-US outputs",
        "using en-US NBest phones for vowel, diphthong or post-vocalic r relations",
        "using overall pronunciation, fluency, prosody or native-likeness scores"
      ],
      "blocked_pending": [],
      "evidence": [
        {
          "claim": "en-AU is a supported pronunciation assessment locale with phoneme-level accuracy scores",
          "source": "https://learn.microsoft.com/en-us/azure/ai-services/speech-service/how-to-pronunciation-assessment",
          "verified": "2026-07-23"
        },
        {
          "claim": "phoneme name, IPA alphabet, syllable group and spoken phoneme output remain en-US only in current documentation",
          "source": "https://learn.microsoft.com/en-us/azure/ai-services/speech-service/how-to-pronunciation-assessment",
          "verified": "2026-07-23"
        },
        {
          "claim": "pronunciation assessment audio is processed in memory, not retained, and stays in the resource region",
          "source": "https://learn.microsoft.com/en-us/legal/cognitive-services/speech-service/speech-to-text/data-privacy-security",
          "verified": "2026-07-23"
        },
        {
          "claim": "Speech resource a private Azure Speech resource created in a private resource group, region Australia East, Free F0 tier",
          "source": "portal.azure.com deployment CognitiveServicesSpeechServices-20260724141741",
          "verified": "2026-07-24"
        }
      ]
    },
    {
      "lane_id": "elsa_scripted_v3",
      "display_name": "ELSA Scripted V3 API",
      "kind": "external_api",
      "role": "conditional_external_exact_substitution",
      "status": "conditional",
      "reason": "Documented phoneme_error_arpabet is the strongest external produced-phone field found, but it fires for substitutions only, no public worked example exists, access requires an NDA before a token, and the MSA confidentiality clause makes benchmark publication a negotiated written permission rather than a default right.",
      "audio_policy": "corpus_transfer_review_required",
      "eligible_sources": [
        "speechocean762",
        "acted_clear_speech",
        "common_phone_1_0",
        "librispeech_slr12_small"
      ],
      "output_semantics": "per phoneme: trans_arpabet, start and end times, decision, nativeness_score, phoneme_error and phoneme_error_arpabet; the error fields present the expected and detected phone for substitutions when decision is incorrect; deletion and insertion semantics are undocumented; the reference model is General American with no Australian variant.",
      "permissions": {
        "benchmark_publication": "written_permission_required",
        "evidence": [
          {
            "claim": "API token is issued only after an NDA is signed",
            "source": "https://api-external-doc.elsanow.co/faq",
            "verified": "2026-07-23"
          },
          {
            "claim": "MSA confidentiality section requires keeping information and materials provided by the other party confidential, so publishing comparative results needs written consent",
            "source": "https://elsaspeak.com/en/legal/msa/",
            "verified": "2026-07-23"
          }
        ]
      },
      "privacy": {
        "processing_region": "closest of Singapore, Ireland or US East; no Australian region",
        "retention": "open ended: personal data retained as long as ELSA deems reasonably necessary; no audio-specific deletion timeline",
        "training_use": "aggregate anonymized usage data may be used to improve products and machine learning capabilities"
      },
      "credentials": {
        "env_var_names": ["ELSA_API_TOKEN"],
        "verified": null
      },
      "prohibited_uses": [
        "treating the General American reference as Australian truth",
        "using the nativeness score at any level",
        "scoring vowel, diphthong or post-vocalic r relations",
        "uploading any audio before written benchmark and publication permission exists"
      ],
      "blocked_pending": [
        "API enquiry, NDA signed by Adam, and token issued",
        "written benchmark and aggregate publication permission",
        "written region, retention, deletion and training-use answers",
        "one real substitution response demonstrating phoneme_error_arpabet format",
        "documented deletion and insertion behavior"
      ],
      "evidence": [
        {
          "claim": "response schema exposes phoneme timing, decisions, phoneme_error and phoneme_error_arpabet",
          "source": "https://api-external-doc.elsanow.co/elsa/scripted_v3/audio_file/post-score-audio",
          "verified": "2026-07-23"
        },
        {
          "claim": "field definitions state the error fields present the correct transcription and what the user pronounced, for substitutions",
          "source": "https://api-external-doc.elsanow.co/Scripted-api-info",
          "verified": "2026-07-23"
        },
        {
          "claim": "no Australian English model is documented anywhere in the public docs",
          "source": "https://api-external-doc.elsanow.co/faq",
          "verified": "2026-07-23"
        }
      ]
    },
    {
      "lane_id": "iflytek_ise_global",
      "display_name": "iFLYTEK Global Pronunciation Assessment (ISE)",
      "kind": "external_api",
      "role": "experimental_public_corpus_comparator",
      "status": "ready",
      "reason": "Account, activated free quota and signed-handshake credential verification exist and public terms contain no benchmarking prohibition, but the English response never names the produced phone, the adult or pupil group switch is documented for Chinese tasks only, and privacy promises are practically unauditable, so this lane is a cheap experimental comparator restricted to public-corpus audio.",
      "audio_policy": "public_corpus_only",
      "eligible_sources": [
        "speechocean762",
        "acted_clear_speech",
        "common_phone_1_0",
        "librispeech_slr12_small"
      ],
      "output_semantics": "English phoneme layer returns beg_pos, content holding the expected phoneme, end_pos and dp_message error flags where 0 is normal, 16 missed, 32 incremental, 64 readback and 128 replacement; a replacement flag never names the produced phone; the group parameter for adult, youth or pupil applies only to Chinese tasks.",
      "permissions": {
        "benchmark_publication": "permitted_by_public_terms",
        "evidence": [
          {
            "claim": "platform agreement contains no clause prohibiting benchmarking, comparative evaluation or publication; contracting party is IFLYTEK Co., Ltd. with PRC court jurisdiction",
            "source": "https://global.xfyun.cn/doc/policy/agreement.html",
            "verified": "2026-07-23"
          }
        ]
      },
      "privacy": {
        "processing_region": "iFLYTEK Open Platform server in Singapore, with lawful transfer out permitted and affiliate sharing allowed",
        "retention": "privacy policy states voice is processed in real time without saving data more than a week; not independently auditable",